Group,Year,Month,Day,Time,End Year,End Month,End Day,End Time,Display Date,Title,Detail,URL,Image URL,Image Credit,Type,Color
,1989,,,,,,,,,元号が「平成」になった,「平成」が「令和」に変わった時も違和感があった。なかなか馴染めず実感がないまま時間だけが過ぎていく感じがした。それでも歩きながら話せるという最新機器にみんな夢中だった。,,,,,
,1989,,,,,,,,,日本初の国産インターネットウイルスが出現される,12月25日にクリスマスメッセージが届く悪質なもので皆を困らせた。「Japanese Christmas」と呼ばれる日本で初めて生まれたコンピューターウイルスだ。おめでたい行事を利用して人を陥れるなんて、コンピューターウイルスはとても迷惑なものだと感じた。,,,,,
,1989,,,,,,,,,元号が「平成」に,消費税が３％に引きあがった頃、日本の元号が「昭和」から「平成」に変わりました。元号が変わる瞬間にテレビを見ていました。変わった瞬間はみんな、パッとしない様子でした。,,,,,
,1989,,,,,,,,,平成時代が始まる,昭和64年が1月７日に終わり、１月８日から平成となった。また、この年に消費税法が施行される。当時の消費税率は3%であったが、1997年4月からは5%、2014年4月からは8%、2019年10月から10%となっている。,,,,,
,1988,,,,,,,,,軽量化された辞書型の携帯電話が発明される,家以外の場所で、公衆電話が無い所でも電話が使える便利さに驚いた。日本テレビが世界初のエベレスト山頂からの生中継を成功させて感動した。8月8日から朝日放送が史上初のハイビジョン生中継の試験放送を行われ、その後ＮＨＫもソウルオリンピックにおいて初のハイビジョン生中継を成功させた。綺麗な画面で白熱した試合を観れることに感激した。より鮮明に選手の動きを観れて嬉しいし、応援の士気も上がった。,,,,,
,1988,,,,,,,,,８月８日から２１日まで、朝日放送が史上初のハイビジョン生中継（試験放送）を第70回全国高校野球選手権大会にて実施,きれいな映像で、遠くにいるのに同じ時間を共有することができるようになった。,,,,,
,1988,,,,,,,,,東京ドーム完成,日本国内で最初のドーム球場として建設された。だが、野球だけでなくさまざまなアーティストがライブなどをおこない、多くの人々が東京ドームに足を運んだ。,,,,,
,1987,,,,,,,,,バブル景気が始まる,,,,,,
,1987,,,,,,,,,BS衛星放送がスタート,日本全国にテレビは普及したが、地域によってはチャンネル数が少なかったり、電波が弱くて映りが悪かったりしたため、衛星放送の開始は難視聴地域にとってはとても嬉しい出来事だった。,,,,,
,1987,,,,,,,,,ショルダーホンより小型化した携帯電話機発売,手のひらにのるハンディタイプの無線電話が市場に出てきた。重さやサイズの問題は以前より解決に向かったものの、まだまだ重かったしサイズが大きかったので持ち運びが苦しかった。,,,,,
,1987,,,,,,,,,ＩＤＯ、関西セルラーが成立した,ＴＢＳとフジテレビが24時間放送を開始した。24時間も番組を継続する斬新な放送に驚いた。東大の国際電子メールサービスが正式に開始される。このサービスが始まった事で海外へ電子メールを送れるようになり、メディアは国と国を繋ぐグローバルな役割も果たせるようになっていく。,,,,,
,1986,,,,,,,,,写ルンです　発売,世界初のレンズ付きフィルムとして「写ルンです」が富士フイルムから発売。コンパクトカメラは高級品だったが、「写ルンです」は24枚撮り1380円というお手頃価格で入手出来る。歓喜した。,,,,,
,1986,,,,,,,,,富士フイルム　映ルンですを発売,まだ、カメラが高級品であった時代に、手軽に買うことが出来るレンズ付きのフィルムカメラが登場した。どんな写真が取れているのか、うまく取れているのか、現像した写真を見るのはワクワクした。中には、うっかりシャッターボタンを押してしまった写真も、、、。,,,,,
,1986,,,,,,,,,バブル景気になり物の流通が盛んになって世の中が栄える,最初の永続の宇宙ステーション「ミール」がロシア(ソ連)で打ち上げられた。宇宙と地球までを繋げるほどにメディアはどんどん規模が大きくなっていく。,,,,,
,1986,,,,,,,,,バブル到来,一般的にこの年からバブル景気とされる。1991年初頭に崩壊するまで4年半続いた株価や地価など資産価格の急激な上昇のこと。戦後で二番目に長い好景気である。,,,,,
,1985,,,,,,,,,NTT設立,日本電信電話公社が民営化され、日本電信電話株式会社(NTT)が発足。アスキーネットが開局したり、加入者交換機のデジタル化を開始した。,,,,,
,1985,,,,,,,,,肩こりショルダーフォン,重量が約3キロで、約20万円の保証金に月額使用料が約2万円という、一部の人にしか買えない高額な車外兼用型自動車電話。持っていることで自慢は出来るかもしれないが、その分ひどい肩こりに悩まされていたであろう。,,,,,
,1985,,,,,,,,,ファミコン　ブーム,テレビゲームにのめりこんだ。高橋名人が本当にすごくて、マネがしたくてずっとゲームをしていた。母親に怒られたり呆れられたりしながらも、たのしかった。お姉ちゃん取り合いになったこともあった。,,,,,
,1985,,,,,,,,,ショルダーホンが誕生する,外出時に持ち運べる電話が誕生した。しかし重さは3㎏となかなか重いので、常に肩こりがひどかった。それでもみんなショルダーホンを手に入れたがっていた。,,,,,
,1985,,,,,,,,,シルバニアファニリー,女の子なら一回はシルバニアファミリーで遊ぶことはあるだろう。私も小学校の時友達の家で遊んだことがある。友達が持っていたのは二階建てで凄かったな。,,,,,
,1985,,,,,,,,,ショルダーホンが発売された,肩掛けタイプのショルダーホンが登場した。カバン並みの大きさで、肩掛けのベルトがあった。本体だけではなく、電池も一緒に運んだので重かった。,,,,,
,1985,,,,,,,,,黒電話でおなじみダイヤル式電話機からプッシュ式電話機に,くるくる回す手間がなくなり、ボタンを押すだけになったのことで、回して、戻ってくる時間が無くなり、時間短縮になった。,,,,,
,1985,,,,,,,,,鞄の様に方にかけて持ち運べる「ショルダーフォン」が発売される,大きめで重さは３ｋｇあり、持ち運ぶのは大変だが、どこでも電話が出来るスタイルは革新的で人気が出た。そしてファミコンが流行した。ゲームはとても楽しくて時間を忘れて没頭できて多くの人が魅了された。日本電信電話公社が民営化した。パーソナルコンピューターが生み出された。パーソナルコンピューターは色々な情報が気軽に知る事が出来るとても高性能な便利なメディアで、皆を驚かせ人々の注目の的だった。,,,,,
,1985,,,,,,,,,レコードからCDへ,今まで音楽を聴くのはレコードからだったが、最近はCDも増えてきているらしい。ただ、まだそこまで普及していなくてCDプレイヤーも手が届く値段ではなかったのでまだ様子見しようかな…。,,,,,
,1985,,,,,,,,,ショルダーフォンの登場,重量は約3㎏で重たいがバッテリーが入っているからしょうがない。でもやはり重たい上に使用料も高額であったため、これを持っていたのはどうしても仕事で使う必要があるという人達くらいだった。,,,,,
,1985,,,,,,,,,阪神タイガース初の日本一に,日本のたばこ産業が発展していく中、プロ野球で阪神タイガースは初の日本一となりました。ビールを片手にテレビに話しかけていたおじいちゃんが急に飛び上がったのを覚えています。,,,,,
,1984,,,,,,,,,新札発行,1000円札が夏目漱石、5000円札が新渡戸稲造、1万円札が福沢諭吉になった。お札には、様々な偽造防止技術があることに驚いた。,,,,,
,1984,,,,,,,,,日本のインターネットの起源「ＪＵＮＥＴ」が開始される,ここから試行錯誤され、更に機械のメディア技術が進歩していく。ＮＨＫが衛星放送の試験放送を「ＮＨＫ衛星第1テレビ」として開始され、テレビもより進化していく。,,,,,
,1984,,,,,,,,,ウォークマン,通学時間に時間をつぶすために購入。渡辺美里を熱心に聴いていた。,,,,,
,1983,,,,,,,,,ファミリーコンピュータ発売,当時の家庭用ゲーム機としては群を抜く高性能を備えていた。本体と同時発売した『ドンキーコング』、『ドンキーコングJR.』、『ポパイ』、その後に『五目ならべ 連珠』と『麻雀』が発売され、家族みんなで楽しむことができた。,,,,,
,1983,,,,,,,,,ファミコンブーム,,,,,,
,1983,,,,,,,,,オープンした東京ディズニーランドへ行く,友人と一緒に東京ディズニーランドへ行った。ミッキーに会うのをとても楽しみにしていたが、思った以上にミッキーの顔が怖かった。しかし今では整形したのかと思うほど可愛らしい顔になっている。,,,,,
,1983,,,,,,,,,ファミリーコンピュータ発売,私の家では買ってもらえず、友達の家に赴き毎日ゲームに明け暮れていた。ファミリーコンピュータという名前だが、家族としたことはなかった気がする。,,,,,
,1983,,,,,,,,,テレビを通じて受講し単位を取得する「放送大学」という新しい学校が生まれて驚いた,テレビ愛知が開局された。民放のテレビ局の数が遂に100局に到達する。多彩なテレビ番組を観れるようになっていき、沢山の魅力的な番組から日々どの番組を観るか選択に迷った。ＮＨＫが東京、大阪で文字多重放送を開始した。音声と映像に加えテロップからも同時に情報を得れるようになって、内容をより理解しやすくなった。,,,,,
,1983,,,,,,,,,やっと手に入れたゲーム機,新作ハードウェアが欲しかった私はおもちゃ屋さんへリベンジしに行った。欲しかったのはファミリーコンピュータだ。今年はリベンジ成功だ。やっと遊べる～嬉しい～！,,,,,
,1983,,,,,,,,,ファミリーコンピュータ発売,ファミコンが発売され「マリオブラザーズ」や「ドンキーコング」で遊んだ。その後も面白いソフトがたくさん出たので姉とゲームの取り合いになった。熱中しすぎてゲームばかりするなと怒られることもあった。,,,,,
,1983,,,,,,,,,ファミコン,忍者ハットリくんのソフトを購入。人気のマリオは友達の家でプレイしていた。,,,,,
,1983,,,,,,,,,ディズニーランド開園,アメリカ国外では当時初となる「ディズニー・テーマパーク」、「東京ディズニーランド」が開園。小さな頃は近くに住んでいたので何度も行ったことがあるが、他のテーマパークでは感じられない夢のような世界観が魅力的な唯一無二の施設だ。今でもディズニーランドに行くという理由だけで東京に行くことがある。,,,,,
,1982,,,,,,,,,テレホンカード発行・発売,日本電信電話公社(電電公社)が、テレホンカード発行・発売を開始した。電話をする際に使用するのはもちろん、レアなものがあったり、コレクションをして楽しむ人もいた。,,,,,
,1982,,,,,,,,,世界初のCDプレーヤーが発売,レコードよりも音質がよく、ノイズが少ない、新鮮な気持ちで音楽を聞くことができた。レコードのアナログ感も味があって良いが、CDのより生音に近い感じも聞き心地が良い。,,,,,
,1982,,,,,,,,,伝言板で待ち合わせ,携帯もポケベルも、スマートフォンも無かった時代。待ち合わせは伝言板を利用していた。会えない不安を抱きながら、待ち合わせ相手のことをぼんやり考えていた。,,,,,
,1982,,,,,,,,,テレホンカードが利用できるようになる,磁気カードのテレホンカードが利用できるカード式公衆電話が登場した。グリーンのボディが目印で枚数限定のアイドルテレカが高額で売買され、社会現象にもなった。自分が好きな人物がのったカードはそれだけで嬉しくなるし大切に保管するが、電話もできるということで便利さも兼ね備えていた。,,,,,
,1982,,,,,,,,,授業でタイプライターを習う,高校の授業で和文のタイプライターを使った。「これどうやって使うの」と戸惑っていた。数回の授業ののち、ワープロに移行された。結局タイプライターは身につかないままだった。,,,,,
,1982,,,,,,,,,テレホンカードが作られた,テレホンカードが生み出されたので、気軽に公衆電話で連絡を取れるようになっていく。テレホンカードの柄やプリントなど色々工夫されて、アイドルの写真が印刷される等レアな柄のテレホンカードを持っているだけでもステータスになった。,,,,,
,1982,,,,,,,,,テレホンカードの登場,いちいち１０円玉を補充しなくて済むので便利に。気づいたら時間切れで切れてしまうなんてことも減って助かる。,,,,,
,1982,,,,,,,,,テレホンカードが発売開始,テレホンカードを使えば小銭がなくても公衆電話を使うことができる。カードのデザインがいろいろあるので見ていて楽しい。でもかわいい絵などが描かれていると使うのがもったいないと思ってしまう。,,,,,
,1982,,,,,,,,,「笑っていいとも」スタート,司会のタモリさんを中心に曜日ごとに変わる豪華なレギュラー陣が毎日さまざまな笑いを届けるお昼の番組。人気なコーナーもたくさんあり、多くの人に親しまれる番組となった。,,,,,
,1982,,,,,,,,,CD発売,これまではレコードが主流であったが、さらにコンパクトとなったCDが発売された。このCD発売を機にレコードの売り上げを抜き、CDが広く普及されることとなる。,,,,,
,1982,,,,,,,,,花の82年組,音楽番組やバラエティーなどテレビ全盛期の時代。シブがき隊のモックンに熱狂。レコードを買っていた。,,,,,
,1982,,,,,,,,,テレホンカード登場,公衆電話の料金を気にして長電話できなかった私たちに神のような存在がでました。それはまさしくテレホンカードです。このカードの登場で、若者の間で爆発的に人気が出ました。レッツ、長電話！,,,,,
,1981,,,,,,,,,FL（蛍光表示管）ゲーム発売,当時はかなり高価だったため、親に買ってもらった時はもう、それはそれは嬉しかった。蛍光表示管を使った画面だったため、他のゲーム機と比べてもとても画面が綺麗だった。,,,,,
,1981,,,,,,,,,アメリカでスペースシャトルが打ち上げられた,昔は宇宙など見当がつかない程遠い場所の存在であったのに、メディアは進化して宇宙まで到達出来るようになった事に驚いた。いつの日か更にこれらの技術が発展したら宇宙旅行も果たす事が出来るかもしれない。東京12チャンネルが史上初となる12時間ドラマの制作を成し遂げた。正午から深夜0時まで目が離せない番組の新しい取り組みに注目された。,,,,,
,1980,,,,,,,,,ゲーム＆ウオッチ,任天堂初の携帯型ゲーム機であり、今では時計が付いているのは当たり前だが、ゲームと時計の機能が付いており、手のひらサイズ。当時は田舎だったので、山付近でゲーム＆ウオッチをポッケに入れて友達たちと遊んでいるといつの間にか落として失くすという事件が発生。友達たちからは責められ、母親からはこっぴどく怒られた。,,,,,
,1980,,,,,,,,,ゲーム&ウオッチ発売,ゲームソフトが本体内のROMに書き込まれていて「1ハード1ソフト」だった。カートリッジ交換で様々なソフトを実行することはできず、今のゲームと比べると独特な造りだ。コンパクトで持ち運びやすく、ゲームはシンプルだが面白く友達と盛り上がれる。ゲームをしないときは時計としても使えて、便利なものだった。,,,,,
,1980,,,,,,,,,ルービックキューブ　発売,父親が面白がって買ってきたが、一回回してしまうともう元には戻らない気がする。遊んだあとは、めちゃくちゃ調べながら元に戻していた。触るのが怖くなったのか、もうもはや飾りになっている。,,,,,
,1980,,,,,,,,,ルービックキューブ,これは今でも知っている人は多い。このルービックキューブがこんな昔に発売されていたとは知らなかった。私はこれが苦手だ。,,,,,
,1980,,,,,,,,,駅の伝言板大活躍,待ち合わせしているのに、友達が来ない。黙っていくわけにもいかないので、そんな時は「先に行っています」と駅の伝言板に書いていた。,,,,,
,1980,,,,,,,,,自動車電話がやってきた,我が家に自動車電話がやってきた。父が建築関係の仕事をしていたため、会社から支給された。私自身が使う機会はほとんどなかったが、車に乗るときはいつも、運転席と助手席の間にある電話を興味津々に眺めていた。,,,,,
,1980,,,,,,,,,ソニーとフィリップスが「コンパクトディスク」、所謂ＣＤを発明した,デジタル技術を記録できるメディアで、レコードに変わって音楽など色々なデータを記録出来るようになって便利になった。ＣＤが生まれたおかげで自分のお気に入りの音楽のＣＤを買っていつでも好きな時に音楽が聴けるようになった。,,,,,
,1980,,,,,,,,,任天堂との出会い,おもちゃ屋さんへ誕生日プレゼントを見に行ったとき、一目惚れしたのが新発売のゲーム＆ウォッチだった。ただ、強請ってみたもののそれだけはダメって言われてしまった。なんのための誕生日プレゼント？,,,,,
,1979,,,,,,,,,あの哀愁漂うBGMが流れる『必殺仕事人』,全84話放送された時代劇。それを観ていた祖母は家に入ってきた虫を退治するとき、「チャララーン～…」と言いながらモップでやっつけていた。,,,,,
,1979,,,,,,,,,ウォークマン発売,ソニーから携帯型ステレオカセットプレーヤーのウォークマンが発売された。いつでもどこでも音楽を聴くことができて、当時は非常に画期的なものだった。イヤホンがあるから周りに人がいても迷惑にならないし、気にせずに自分の好きな音楽を楽しむことができた。,,,,,
,1979,,,,,,,,,うまい棒,小学生や高校生の時は「10円あったらうまい棒買えるよ」とよく言っていた。10円で買えるお菓子は滅多にないのでうまい棒は低学年のころ私達の味方であった。,,,,,
,1979,,,,,,,,,ウォークマン発売,お気に入りだった松任谷由実の曲をカセットテープにダビングし、ウォークマンに入れ持ち歩いていた。通学中にも音楽が聴けるようになったため、学校に行くことが少し楽しみになった。,,,,,
,1979,,,,,,,,,ジェームズ・リッティによって、キャッシュレジスター、所謂レジが生み出された,この人の発明があったからスーパーでレジが使える様になり、客の買い物の会計がスムーズに行える様になって便利になった。UNIXコンピュータ同士をシリアル回線経由で接続するUUCPと呼ばれるプロトコルが誕生した。開発された事で、電子メールやネットニュース等転送目的で多くのコンピュータが相互接続された。,,,,,
,1979,,,,,,,,,ドラえもん連載開始,,,,,,
,1979,,,,,,,,,大阪駅前第３ビル完成！,大阪駅の前にめちゃくちゃ高いビルが建った。この高い建物の中にどれだけたくさんの商業施設が入っているのだろうかとワクワクした。,,,,,
,1979,,,,,,,,,初めてのアニメ,このときドラえもんが放送開始された。学校では友達とこの話で持ち切りだった。みんなで話すネタになっていた。みんなの人気者のドラえもんだ。,,,,,
,1978,,,,,,,,,侵略してくる敵を撃ちまくれ！『スペースインベーダー』,当時、発売されたアーケードゲームは駄菓子屋に置いてあったため、数少ない小遣いを持って行って遊んだり、他の子がやっているところを羨ましそうに見ていた。またモニターが白黒だったため、上からカラーテープを貼って楽しんでいた。,,,,,
,1978,,,,,,,,,テレビゲーム「スペースインベーダー」が大ブーム,こんどは宇宙戦艦ヤマトみたいな宇宙で戦うゲームが発売された。でもゲームセンターに行かないといけないから家でもゲームができるようになればいいのにと思った。,,,,,
,1978,,,,,,,,,24時間テレビ　初放送,24時間本当にテレビをやるのか、と驚いた。出ている人たちはしんどくないのか心配になる。でもその分お給料ももらえたりするんだろうか。メインテーマは、「寝たきり老人にお風呂を!身障者にリフト付きバスと車椅子を!」である。,,,,,
,1978,,,,,,,,,『銀河鉄道999』放送開始,松本零士作のSF漫画を原作としたテレビアニメ番組『銀河鉄道999』が放送開始した。登場人物のヒロイン、メーテルに恋をしてメーテルの絵を1日中描いていた。彼女は年上ヒロインの究極形である。,,,,,
,1978,,,,,,,,,「ザ・ベストテン放送開始」ビデオデッキで録音,百恵ちゃんの大ファンだった私は、この時間になるとテレビの前にカセットデッキをセットし、録音していた。録音のため、家族に「静かにして」とお願いしているのにも関わらず、たまに誰かの声が入っていた。,,,,,
,1978,,,,,,,,,アメリカでアップル社がパソコンにディスク・ドライヴを初めて取り入れられた出来事が印象的だ,又、ウィリアム・クルックスが、クルックス管を生み出した。クルックス管は、初期の実験用真空放電管である。真空放電管の実験を行う際に役立った。更に、ヘンリー・フリュスによって潜水用酸素供給機構、リブリーザーが開発された。呼吸排気から二酸化炭素を取り除き、酸素を補って再利用する循環式呼吸装置であるリブリーザーが生み出された事で長く潜水出来るようになりダイビングの技術も発展し、楽しめるようになった。,,,,,
,1978,,,,,,,,,24時間テレビ放送,生放送で24時間も放送するこの番組にとても驚いた。夜中もずっとテレビが放送されていることがとても新鮮でずっと起きて見ていようと思ったが、寝てしまっていて気づいたら朝になっていた。,,,,,
,1977,,,,,,,,,人気アニメ続々,『あらいぐまラスカル』や『ヤッターマン』など、さまざまなアニメが放送され、今でも人気のあるキャラクターが数多く存在する。,,,,,
,1977,,,,,,,,,白黒テレビ放送が廃止,白黒の番組の制作が終了し、全てカラーになった。カラーテレビもかなり普及され、白黒で見ることも減っていた。しかし白黒は思い出深く、もう放送されないとなると少し寂しい気がした。放送終了してから白黒もあれはあれでよかったなと思うことがある。,,,,,
,1977,,,,,,,,,白黒テレビ放送が廃止される,白黒だと色味が全く分からなかったので、カラーになって私はとても嬉しかった。今では逆に白黒で写真を撮る人もいたりして、モノクロの世界を魅力に感じる人もいることを知った。,,,,,
