Group,Year,Month,Day,Time,End Year,End Month,End Day,End Time,Display Date,Title,Detail,URL,Image URL,Image Credit,Type,Color
,2008,,,,,,,,,Wii購入,Wiiを買ってもらったもののいまいち何をしていたか記憶がない。でもゲームっ子だったことは覚えている。この年にお父さんが夜な夜なWiiのどうぶつの森をしていたことや、自分でソフトを買ってきたことは覚えている。,,,,,
,2008,,,,,,,,,Twitter日本語版が展開,私がTwitterを使い始めたのは2017年からだったが、もっと前に日本語版ができていた。誤った情報の拡散や誹謗中傷など問題点もたくさんあるので、使い方に気を付けないといけないと思った。,,,,,
,2008,,,,,,,,,DSiを購入する,これまではDS　Liteを使っていたが、弟と二人で使っていたのでいつも取り合いになっていた。そのためDSiは初めて自分用のゲーム機だった。また、公園など外で遊ぶだけでなく家でゲームの通信をして友達と遊ぶことが増え、遊び方に変化があったように思う。,,,,,
,2007,,,,,,,,,書道を習い始める,毛筆に興味があったので、近所の書道教室で中学生まで習った。高校生になって、授業で書道をとったり書道部に入部した。,,,,,
,2007,,,,,,,,,飽き性には困難なたまごっちプラス,私は少々飽き性なところがあるため、最初は熱心にたまごっちを育てていても途中で冷めてしまい放置し、結果数々のたまごっちを死に追いやってしまった。私がやらなくなった代わりに母がたまごっちを立派に育て上げていた。,,,,,
,2007,,,,,,,,,キャラクター・ボーカル・シリーズ「初音ミク」が発売,このソフトで、たくさんの曲が作られ、現在その数10万曲以上に上るとされている。私は友達の話から初音ミクを知った。聴いてみると今まで聴いてきた音楽と違うような不思議な感じがした。いろんな曲を聴いてみると曲ごとに「初音ミク」の声の感じが違っていた。いろんな声を出せる「初音ミク」に魅力を感じた。そして、その技術に関心した。,,,,,
,2007,,,,,,,,,小学校へ入学する,小学一年生になり、防犯ブザーをランドセルにつけて登校するようになる。当時は音が鳴るのが面白くて無意味に何度もひもを引っ張りうるさく音を出して遊んだ。今考えると迷惑でしかない。,,,,,
,2007,,,,,,,,,テレビアニメ『しゅごキャラ！』放送開始,テレビアニメ『しゅごキャラ！』に熱中する。作中に登場する「なりたい自分が形になったたまご」が自分のところにも現れると本気で信じていた。少女マンガ雑誌『なかよし』を購入してもらったため「アニメには原作漫画がある」ということを知り、原作漫画も入手する。,,,,,
,2007,,,,,,,,,子供用の携帯電話をもたす親が現れる,小学生になると通学を親なしでするし、習い事が始まって一人で登下校する人も増えた。親が共働きだと鍵を自分でもって危険だったので防犯ブザーを必ず持つよう指示され、小さい子供用の携帯電話を身につけている人もいた。私は、その携帯電話が羨ましかったが買ってくれなかったので憧れを抱いていた。,,,,,
,2007,,,,,,,,,薄いテレビが我が家にやってきた,引っ越すと同時に、ブラウン管のテレビから薄い液晶テレビになった。今に比べたらその時液晶テレビは分厚かったが、その当時は嬉しくてたまらなかった。ブラウン管のテレビはよく砂嵐がおきていたなと今思えば懐かしい。,,,,,
,2007,,,,,,,,,プリキュアになりきる,「Yes!プリキュア5｣を見て、友達と5人になりきった。当時私は髪が長かったためよくキュアアクアになっていた。姉や兄にVHSでの録画を独占されていたため、日曜朝7時半から「ポケモン☆サンデー」→「Yes!プリキュア5」の1時間半ずっとテレビに張り付いていた。,,,,,
,2007,,,,,,,,,友達や従妹がDSを持っていて憧れた,「おいでよ！どうぶつの森」等とても癒され可愛いソフトを多く持っていた。その友達は「トモダチコレクション」のソフトも持っていて、実際に存在する友達をイメージして作ったキャラクターを作りゲーム内のマンションに住まわせていて、私のキャラクターも作ってくれて嬉しかった。ファッションの漫画が流行っていてカードを重ねて服を組み合わせる遊びが友達の間で流行した。,,,,,
,2007,,,,,,,,,キッズ携帯購入,小学生に入学すると同時にキッズ携帯を買った。なぜなら私は小さ過ぎて公衆電話に届かなかったからだ。それだけの理由である。あの携帯はホーム画面に変な生き物が住んでいた。,,,,,
,2007,,,,,,,,,iPhoneがおもちゃ？,祖父がデジタル系の新しいものに目がなくて、使わなくなったiPhoneをおもちゃとして私にくれるほどの人だった。良く考えたら、私にとってのスマートフォンデビューはこのときだったのかもしれないが、一旦置いておく。,,,,,
,2007,,,,,,,,,ユニバーサルスタジオジャパンが顔認証を導入,今では年パスを購入時すぐに顔写真が登録でき、顔認証があたりまえとなっているが、当時は顔認証で入場時に少し時間がかかっていた。だが、顔で伝えることができる新しい技術だなと感じた。,,,,,
,2007,,,,,,,,,Wii,DSでたくさん遊んでいたがそれと同じくらいWiiでもたくさん遊んだ。Wiiは大人数で遊ぶことが出来るのでよく友達の家に行った時に遊んでいた。,,,,,
,2006,,,,,,,,,任天堂の家庭用ゲーム機「Wii」が発売,このゲーム機は家族みんなで買いに行った。誕生日でもご褒美でもなんでもないときにゲームを買ってもらえることはめったになかったから、すごくワクワクした。家に帰って遊んでみると、楽しくてずっと遊んでいた。リモコンがまだ少なくて「次かわってー」と家族が順番待ちしていた。,,,,,
,2006,,,,,,,,,もっと脳を鍛える大人のDSトレーニングが発売,ついにゲーム機で勉強できるようになったとテンションが上がった。おばあちゃんにやらせてあげるととっても嬉しそうだった。いつまでも若く生きててほしいなと思った。私はもっと勉強しなければならない。,,,,,
,2006,,,,,,,,,ニンテンドーDSを買ってもらう,どうしても「マリオカート」をプレイしたかったため、買ってもらう。友達とカーレースを楽しんだ。私はいつも遊ぶ友人の中で毎回一位を取っていて嬉しかった。,,,,,
,2006,,,,,,,,,ニンテンドーDS　Lite発売,2005年に発売されたニンテンドーDS専用ゲームソフト『おいでよどうぶつの森』と合わせて購入してもらう。留守番が苦にならなくなる。現在はオンラインが主流だが、DSの通信は対面で行うため友達と交流する機会が増えた。,,,,,
,2006,,,,,,,,,DSにはまる,兄と共同で使っていたDS。どっちが使うか何度もけんかした。使いすぎて、中のケーブルの線が見えるようになったくらいボロボロになった。よく使っていたソフトは、差し込んでも反応しないことが多く、よく息を吹きかけてほこりを飛ばしていた。,,,,,
,2006,,,,,,,,,「ニコニコ動画」のサービスが開始し色々な動画が観れるようになった,テレビで「カートゥ―ンネットワーク」に登録して貰っていて、海外の多くのアニメを観る事が出来た。特に「トムとジェリー」や「バックスバニーショー」、「スヌーピー」、「フォスターズホーム」、「パワーパフガールズ」等が好きだった。海外のアニメーションの過剰にデフォルメされた雰囲気のキャラクターデザインが可愛くて釘付けだった。「パワーパフガールズ」は友達も好きで家で一緒に見た事もあった。,,,,,
,2006,,,,,,,,,初めてのキッズケータイ,小学生になったため、防犯ブザー付きキッズケータイを買ってもらった。周りに持っている子が少なかったので、親に連絡したいと言われたときは大体私のケータイで電話していた。いや、ケータイ買ってもらえよと思った。,,,,,
,2006,,,,,,,,,Wiiが発売,小さいころからゲームが好きだったので、Wiiも家族や友達と何回もした。一番記憶に残っているのはWii Sportsのテニスだ。ラケットをブンブンさせるのが楽しかった。,,,,,
,2006,,,,,,,,,クラス内で手紙交換が流行る,幼稚園の友達と手紙交換をする。折り方や色ペンなど様々な工夫を凝らした手紙を書いていた。内容は全く覚えていない。,,,,,
,2006,,,,,,,,,トリノ冬季五輪金メダル,任天堂がWiiを発売し、若い世代に人気をもたらした。そして荒川静香氏がトリノ冬季五輪フィギュアスケートで金メダルを獲得した。同時に、侍ジャパンが第一回WBCで優勝した。,,,,,
,2006,,,,,,,,,DS,私は姉とDSでよく遊んでいた。DSで一番よく遊んでいたソフトは「マリオカート」と「スーパーマリオブラザーズ」だ。でも、本当に私はDSに依存してた暗い遊んでいたので他にも様々なソフトで遊んでいた。今の子供たちはスイッチなのでDSももう昔に感じる。,,,,,
,2005,,,,,,,,,私だけが人間「おいでよどうぶつの森」,主人公以外村の住人が個性的な動物であることに衝撃を受けた。また、主人公の顔が村に着くまでの間のあやしい猫との会話によって決まるというのも面白い発想だと思った。家の増築のローンを返済したのも母であり、100万もするクイーンの冠を買うためにお金を稼いでくれたのも母であった。,,,,,
,2005,,,,,,,,,日本プロ野球 セ・パ交流戦が開幕,お父さんもお母さんもとてもテンションが上がっていて、無理やり試合を見に行かされる。初めて行ったけど、応援や選手それぞれのパフォーマンスが面白くて、予想以上に楽しかった。,,,,,
,2005,,,,,,,,,超じんせーエンジョイ！たまごっちプラスが発売される,母と妹と三人で色や柄の違うたまごっちを買ってもらう。友達と見せ合ったりして楽しんだ。しかしすぐ死んでしまう。,,,,,
,2005,,,,,,,,,祝ケータイかいツー！たまごっちプラス赤いシリーズ(りんごれっど)発売,購入するべく、友達と一緒にトイザらスのたまごっち販売コーナーに出来ていた行列に並んだ。たまごっちの育成に1日の全てを費やす日々が始まった。友達のたまごっちや全国の玩具店に設置してあるでかたまごっちと通信をして遊ぶのに夢中になっていた。,,,,,
,2005,,,,,,,,,ＹｏｕＴｕｂｅが開始される,初めてＹｏｕＴｕｂｅに動画が投稿された。動物園にいる自分を撮った短い１８秒の動画を投稿したのだ。まだ見る人も少なかったため、収益になるとは思わなかったし、職業になることも想像つかなかった。ここから、徐々に人気なアプリと化した。,,,,,
,2005,,,,,,,,,たまごっちにはまる,"普通の大きさのたまごっち、大きいサイズのたまごっち、小さすぎるサイズのたまごっち、ユニクロとコラボしたたまごっち、など様々な、たまごっちを持っていた。
毎日トイレをさせたあげたり、ごはんをあげたり、最初は楽しくやっていたが途中で飽きて、その後母がたまっごちの世話を代わりにやるようになった。",,,,,
,2005,,,,,,,,,幼稚園で家族ごっこが流行した,家庭の特定の役割になりきる、ままごとの様な遊びだが、お姉さん、お母さん、妹等の役割に加えて何故かプリキュアの枠もあった。幼稚園でチーム分けする際にチームプリキュアと名付けたいと意見が出るほどにプリキュアは人気であった。「ディズニー」のプリンセス等のキャラも人気でリカちゃん人形やポポちゃんや「こえだちゃんの木のおうち」等人形遊びも流行った。,,,,,
,2005,,,,,,,,,オシャレ魔女ラブandベリーをしていた,ゲームセンターにあるカードゲームだ。主人公は二人いるのだが、ベリーが好きだった。ラブの方が可愛いのに。絶対。,,,,,
,2005,,,,,,,,,いとこに初めてたまごっちをもらう,当時のたまごっちはもちろん白黒。しかし今と変わらず、こまめにお世話をしなければ死んでしまう。日中、幼稚園に行っている間は母にお世話を任せていた。生まれたばかりの弟のお世話に、娘のたまごっちのお世話、どれだけ大変だったか、今ならありがたみが分かる。近所の人に聞くと、最近の子も、幼稚園や小学校に行っている間はお母さんにお世話を頼む子が多いようだ。機能は進化しても、変わらないものもあるんだと感心する。,,,,,
,2005,,,,,,,,,みんな観ていたプリキュア,プリキュアは女の子に大きな希望をくれた最高のアニメだった。幼い子でも分かるような人間関係で、伝えたいことをまっすぐに伝えてくれる不朽の名作である。ちなみに推しはキュアブラックだ。,,,,,
,2005,,,,,,,,,たまごっちを買ってもらう,誕生日プレゼントとしてたまごっちを買ってもらう。冬の朝、寒い中父に並んでもらったらしい。常に首からかけて肌身離さず持っていた。,,,,,
,2005,,,,,,,,,超じんせーエンジョイ！ たまごっち発売,2個持ちしていた。友達みんな首から下げていたのをよく覚えている。当時習っていたフラダンスの教室にもたまごっちを持って行き、通信をしていた。,,,,,
,2005,,,,,,,,,Tiktokが登場,今、小学生もスマホを持つこ世代、和達たちの周りにはtiktokと言う新たなアプリが誕生した。Tiktokは誰でも動画を投稿でき、そして、誰でも動画にコメントを書くことが出来る。したがって、まだ、言葉に重みがあることをわかっていない小学生などの誹謗中傷なコメントも見られる。私が小学生の頃、スマホを持っている者も少なかったし、SNSで知らない人と絡むこともなかった。,,,,,
,2004,,,,,,,,,Facebook設立,アメリカのカリフォルニア州メンローパークに本社があり、多くの人がFacebookを利用している。設立当時はThe Facebookであった。,,,,,
,2004,,,,,,,,,第2期たまごっちシリーズ「かえってきた！たまごっちプラス」が発売,私は母に連れられてお店に行って、たまごっちを買ってもらった。欲しいと言ったことが無かったが買ってもらえて、ずっとなんで買ってくれたのだろうと思っていた。でも遊び方が分かって面白いものだとわかったので、すっかりはまってしまった。外出でたまごっちを連れていけないときは、放置で死んでしまったら嫌だから、たまごっちの時間を止めていた。,,,,,
,2004,,,,,,,,,テレビアニメ『マーメイドメロディーぴちぴちピッチ　ピュア』放送開始,絵本『人魚姫』が大好きだった私は、人魚が登場する作品『ぴちぴちピッチ』に夢中になる。テレビアニメ第1期『マーメイドメロディーぴちぴちピッチ』の方もVHSのDVDをレンタルしてもらって何度も観ていた。歌を歌って敵を倒すのが特徴的で、アニメの中で登場するたくさんの歌や振り付けを覚えていた。,,,,,
,2004,,,,,,,,,キッズコンピューター・ピコにはまる,テレビにつなげて遊ぶゲーム機である。その当時大好きだった、しまじろうのソフトでずっと遊んでいた。今に比べ、タッチペンでタッチしても反応しないことが多く、イライラしたことを覚えている。,,,,,
,2004,,,,,,,,,プリキュアのシリーズの最初の作品である「ふたりはプリキュア」が始まって、よく見ていた,ＴＯＭＹのオモチャの携帯で遊ぶのが楽しかった。赤外線で同じ商品の別個体と通信する事も出来て、キャラクターに電話が掛けられる面白いものだった。本物の携帯と近い部分もありクオリティがとても高く驚いた。,,,,,
,2004,,,,,,,,,二人はプリキュアが大好きだった,必ず見ていた。今では謎だがなぜか当時は、キュアブラックの方が好きだった。絶対ホワイトの方が可愛い。,,,,,
,2004,,,,,,,,,ニンテンドーDS発売,この頃の私はゲームにまったく興味はなかった。ゲームと言えば、据え置き型か、携帯型かのどちらかであったが、今ではその両方を兼ねそろえたSwitchがある。ゲームだけでなくインターネット環境もある。10年あまりでここまでの進化を遂げていることに驚きを隠せない。,,,,,
,2004,,,,,,,,,母親と行ったイオンで買ってもらったニンテンドーDSにドハマりした。マリオカートDSを本体と一緒に買ってもらった。家族でのコミュニケーションツールが増え、とても楽しかった。,,,,,,
,2004,,,,,,,,,ニンテンドーDS発売,家には3DSやDSiなどいくつかDSがあって初代のDSも一機だけあった。真ん中の部分が取れかかっていて無残な状態になっていたので、物は大切に扱わないといけないと学んだ。,,,,,
,2004,,,,,,,,,ハウルの動く城が公開される,どういう経緯か全く覚えていないが、祖父と２人で映画館へ観に行った。しかし、動く城が怖く感じ、途中で映画館を出て行ってしまった。未だにどんな話か知らない。,,,,,
,2004,,,,,,,,,ニンテンドーDS発売,発売日に祖父が買ってくれたことをよく覚えている。手に入れるのが早すぎて、周りの子は誰も持っていなかった。Liteが登場した頃は皆持っていたのだが、自分だけ大きな初期DSで少しだけ恥ずかしかった。,,,,,
,2003,,,,,,,,,プリウスが発売,電気自動車についての漫画を読み、すごいなと思った。とても静からしい。通学途中に後ろから来たことに気づかず、クラクションを鳴らされた。いい気分ではない。普段は静かなほうがいいけど、事故が増えそうだなあ。,,,,,
,2003,,,,,,,,,ミニディスクを使用して音楽を聴く,手の中にすっぽりと収まる手のひらサイズなところが好きだったという印象が強い。録音媒体として使用したり、音楽を聴くために使用したりしていた。,,,,,
,2003,,,,,,,,,ドラえもんをずっとみていた,兄がいた影響もありよくドラえもんを見ていた。その当時VHSにしかダビングできなかったので、大量のドラえもんのVHSのカセットが家にあった。ちなみに初めて見た映画もドラえもんだった。,,,,,
,2003,,,,,,,,,しまじろうの教育ビデオ等テレビをよく見ていた,当時はまだブラウン管テレビで画質も今より粗さが目立ち画面が小さかった。ビデオで「美女と野獣」や「シンデレラ」等ディズニー作品を多く見ていた。ミニモニパソコンという子供向けのパソコンを貰った。相性診断やクイズなど簡単なミニゲームを行えて、本物のパソコンみたいで楽しくてずっと触っていた。,,,,,
,2003,,,,,,,,,「ふたりはプリキュア」に夢中になる,幼少期から、朝は普段はなかなか起きない私だったが、日曜の朝だけは早起きしてTVにかじりつくようにして見ていた。ほかにも、カートゥーンネットワークやキッズステーション、アニマックスなど、アニメ専門チャンネルで放映されるアニメが大好きで、まさに「テレビっ子」であった。,,,,,
,2002,,,,,,,,,いまでは考えられない15秒動画,この頃はまだガラケーであり、動画も15秒しか撮れなかった。そのためガラケーで母が撮った、私が2歳のころの動画を観てもどれも中途半端に途切れて終わってしまっていた。今ではいくらでも動画は撮れてしまうため、なんだか15秒って貴重だなと思った。,,,,,
,2002,,,,,,,,,写メが流行,画像の送受信サービス「写メール」が流行した。これによって多くの写真を共有出来て、一緒に撮った写真を保有出来たり思い出を形として残すことが簡単になった。文章を分かりやすくするために活用されたり、視野が広がった。,,,,,
,2002,,,,,,,,,３G回線の商用サービスをKDDIグループとJ-PHONE（現ソフトバンクモバイル）も開始される,どんどん携帯電話等デジタル機器が発展していき、電波も整備されていき便利になっていく。家族に神社など連れて行ってもらった際にデジタルカメラや「写ルンです」で写真を撮ってもらっていた。,,,,,
,2002,,,,,,,,,デジカメを購入する,これまでフィルムカメラだったカメラが大きな進歩を遂げた。しかし、どうやら何も分からない私はデジカメの写真をにこにこしながらどんどん消去していたらしい。恐ろしい。,,,,,
,2001,,,,,,,,,同時多発テロ,突然速報が流れ、テレビ画面が切り替わると、ビルに飛行機が突き刺さっていた。その後もう一機がビルに衝突するところ、ビルが崩れていくかところをリアルタイムで目撃した。衝撃的な映像で、あんぐりとしてしまった。一青窈さんの『ハナミズキ』を聞くと今でもその映像が頭で流れてくる。,,,,,
,2001,,,,,,,,,カメラ付携帯電話が発売された,家族が携帯電話を持っていて簡単な釣りのゲーム等も出来て携帯電話は色んな事が出来てとても便利なものなんだと感じた。「Yahoo! BB」のサービスも開始されていき、ネット社会はより便利になっていく。,,,,,
,2001,,,,,,,,,アメリカで同時多発テロ発生,日本では三井住友銀行が誕生したと同時に、アメリカでは同時多発テロが発生していた。この事件で多くの人がなくなり、世界中の驚きの声が上がっていた。それと同時に雅子さまがご出産、敬宮愛子さまと命名された。,,,,,
,2000,,,,,,,,,プレステ２が出る,私のお姉ちゃんがドはまりし、家にいる間はずっとしている。私は見るほうが好きなので、それをよく見ている。攻略本みたいなのもたくさんある。こういうのを極める人ってすごいなとつくづく思う。,,,,,
,2000,,,,,,,,,テレビ放送で人気な番組が多々始まる,テレビ放送で今でも人気の番組が始まった。爆笑そっくりものまね紅白歌合戦など２０００年のゴールデンを飾る番組は長く続いたように思う。,,,,,
,2000,,,,,,,,,2000年問題,色々なメディアで、2000年になったらコンピュータが誤作動をするのではないかと懸念されていたが、実際には何も起こらず良い意味で拍子抜けした。メディアに振り回されるのは今も当時も変わらないのだ。,,,,,
,2000,,,,,,,,,ロボット型検索エンジンとして人気で世界中有名であるGoogleが日本語サービスを開始した,莫大のウェブページを日本語で検索する事が可能となり、インターネットの利便性が格段に上がった。又、無料プロパイダである「ライブドア」がインターネット接続サービスを開始し、より便利になった。日本政府の「e-Japan」政策を元に、2000年12月31日から1年間にわたり、インターネット上における万国博覧会をイメージした、インパクと呼ばれる「インターネット博覧会」と題したイベントが開催された。インターネットがどんどん普及されていった事が分かる。,,,,,
,2000,,,,,,,,,とっとこハム太郎放送開始,ハム太郎のアニメはよく見ていたが、自分が生まれるよりも前から始まっていたことは知らなかった。こうしくんの声が面白いのでとても印象に残る。,,,,,
