Group,Year,Month,Day,Time,End Year,End Month,End Day,End Time,Display Date,Title,Detail,URL,Image URL,Image Credit,Type,Color
,1953,,,,,,,,,日本で初めての放送事故が発生,ラジオから急に何も流れなくなったから壊れたのかと思ったけど、どうもスタッフが緊張してボタンを押し間違えたらしい。私はかわいいなと思ったけど、お父さんは楽しみにしていただけに怒っていた。,,,,,
,1953,,,,,,,,,白黒テレビの放送が開始される,初めてテレビを見たときは、「なんだこの箱は?!」と不思議なものが家に来たことに驚くと同時に、とてもわくわくしていた。,,,,,
,1953,,,,,,,,,街頭テレビが人気,テレビ受像機は非常に高価なものだった。高嶺の花のような存在だ。どうしても買えなかった。そして、街角に置いてある街頭テレビに誰もが夢中になった。テレビって面白いなと感心した。,,,,,
,1953,,,,,,,,,青電話が登場,１０円硬貨を用いた公衆電話。話し中でも最低の１０円がとられるなど納得する公衆電話ではなかった。もったいない気持ちになったのであらかじめ話す内容を決めて電話をかけるようにしていた。,,,,,
,1953,,,,,,,,,テレビ本放送開始,白黒テレビが発売されたが、高価なため私の家も友人たちの家でも買えなかった。そのため銭湯に行くといつもお風呂そっちのけでテレビに夢中になっていた。,,,,,
,1953,,,,,,,,,松下電器は本格的な電気冷蔵庫である「NR－351」を開発した,"電気冷蔵庫は買いだめしても腐らないし、食べ物を良い品質で保ってくれる主婦の力強い味方である、この商品は人気を博した。
「ジオデシック・ドーム」という、球に近い正多面体である正十二面体ないし正二十面体、あるいは半正多面体の切頂二十面体を、さらに対称性をできるだけ持たせながら正三角形に近い三角形で細分割し、球面をその測地線（ジオデシック）ないし測地線を近似する線分の集まりで構成したドームが生み出された。とても計算されたこのドームの新しい形に驚いた。",,,,,
,1953,,,,,,,,,テレビ本放送開始で街頭テレビが人気に、エベレスト初登頂成功,,,,,,
,1953,,,,,,,,,日本初！箱の中の写真が動く！？白黒テレビ登場,松下電器からテレビが発売された。初任給の54倍だなんて相当裕福な家でないとお目にかかることはできなかった・・・。カラーテレビが登場した頃にようやく庶民でも手に入る値段になった。,,,,,
,1953,,,,,,,,,日本テレビ本放送開始,街頭テレビができ、父親はプロレスの放送があると決まってテレビ前に行っていた。試しに私も見に行こうとしたが、これでもかというくらい人が集まりすぎて、見えなくて断念して家に帰った。,,,,,
,1953,,,,,,,,,硬貨式公衆電話,1952年から10円玉硬貨が流通され始めたため、翌年硬貨による公衆電話が登場した。電話が繋がってから10秒間は料金を払わなくても通話ができた。,,,,,
,1953,,,,,,,,,電化元年,冷蔵庫、洗濯機、トースター等が発売される。うちの家にはないため、お金持ちの子の家で見せてもらう。,,,,,
,1953,,,,,,,,,テレビ本放送開始,NHKのテレビ放送が始まる。今ではテレビがあること、番組があることが当たり前のようだが、当時はNHKのみ、画面は白黒、電器店で見る人がほとんどだった。それに次いで日本テレビも放送を開始した。,,,,,
,1953,,,,,,,,,テレビ番組放送開始,最初のテレビ番組の放送はNHK。当時テレビの値段は17万円以上でとても買えなかった。だけどテレビは見たい。関東には公園に街頭テレビが置いてあって、みんなで見ることができたらしい。私の住んでいるところにはそんなものなかったから羨ましかった。テレビ見たいけどお金がない。,,,,,
,1952,,,,,,,,,第1号機白黒テレビ誕生,松下電器製17型の第1号機が、テレビの本放送が始まる1年前に発売された。価格は29万円と今より高価だった。,,,,,
,1952,,,,,,,,,超高級白黒テレビ誕生,松下電器製17型の第1号機。当時の価格は29万円でなんとその頃の初任給の54倍！とても手が出ない、雲の上の存在である。,,,,,
,1952,,,,,,,,,松下電器製の「第一号白黒テレビ」が発明された,"松下電器製の「第一号白黒テレビ」が発明された。世間はテレビという箱の中で色々な映像が動き話すという新しい文明に釘付けであった。しかし価格は29万と当時の初任給で約54倍の値段であった。とても高く一般庶民には中々手を出しづらい状況で、テレビのある家はお金持ちだと一目置かれた。
戦後の復興に励む中、通信省、電気通信省、と官営で行われてきた電信電話事業が引き継がれ、「日本電信電話公社」が成立した。『すぐつながる電話』という国民の要望に応えるべく、さまざまな取り組みを行い、奮闘した。
離れた場所にも光を伝える伝送路である「光ファイバー」が生み出され、より便利になった。中松義郎が関与して生み出した複数の音響機器「ナカビゾン」が発明された。種類は重色レコード、万能シートレコーダー、シート式学習機などがある。これらが進化し。後のフロッピーディスクの発明に繋がったと考えられ、感慨深いメディアだ。",,,,,
,1952,,,,,,,,,日本初のボクシング世界王者誕生,,,,,,
,1952,,,,,,,,,硬貨式公衆電話が誕生,日本で初めて公衆電話が誕生しました。お金を入れれば、誰でもどこでも電話ができるそうです。でも私は、お小遣いが少ないので電話よりお菓子に使いたいです。,,,,,
,1952,,,,,,,,,日本で初めての『スーパーマーケット』,大阪の京橋で『京阪スーパーマーケット』がオープンした。『スーパーマーケット』と店名につけたのはここが初めてらしい。当時は「スーパーマーケットってよくわからないけどとにかくお店なのかな」くらいの認識だった。とりあえず新しいお店がオープンすることはワクワクすることだから行きたいなと思っていた。,,,,,
,1951,,,,,,,,,第1目の紅白歌合戦,『第1回NHK紅白歌合戦』は、1月3日に20時から21時まで、NHKラジオ第1にて生放送。当時は現在のような、大晦日に長時間放送される生放送番組ではなかった。,,,,,
,1951,,,,,,,,,最初の洗濯機登場,「三種の神器」で一番初めに登場した。大型のドラムの中で攪拌(かくはん)棒をまわすというシンプルな構造であるが、まだこの時は脱水機能がなかったため、乾かすのに時間がかかった。,,,,,
,1951,,,,,,,,,ミルキー,今も愛されているミルキーは1951年に発売された。CMでよく使われていた「ミルキーはママの味」このフレーズの都市伝説が回っており小学生の頃友達と話していたのを覚えている。,,,,,
,1951,,,,,,,,,『第1回NHK紅白歌合戦』,1月3日、正月のラジオ番組として記念すべき第1回NHK紅白歌合戦が行われた。テレビ放送はまだ始まっておらず、ラジオによる中継だった。夢中になって歌手を応援した。紅組を応援していたが、優勝したのは白組。悔しい。,,,,,
,1951,,,,,,,,,第１回NHK紅白歌合戦　放送,「第１回紅白歌合戦」というのは、後につけられた名称であり放送当時は「紅白音楽合戦」であった。出演者は今に比べると少なく、１４名ほどであった。また、曲目や曲順は事前に八評されるのではなく、オンエアでのお楽しみであった。,,,,,
,1951,,,,,,,,,ラジオ民間放送開始,ラジオにて無料で聴ける放送が開始された。その頃ラジオ体操第1が制定され、ラジオから流れてくる軽快な音楽に合わせて家族と腕を回した。,,,,,
,1951,,,,,,,,,「丸型攪拌式電気洗濯機」が開発された,"「三種の神器」の中で最も早く生み出されたのが洗濯機だった。洗濯板でいちいち手作業であらう手間が省け、主婦はこの発明に大助かりだった。
ラジオも「民間放送」が始まった。ラジオは当時情報収集にとても便利なツールだった。電波が繋がると音声を受信するラジオの仕組みが大変興味深かった。
アメリカのCBSが「最初のカラーテレビ放送」を開始した。白黒の映像が記録され、放送されるだけでも新しい技術に感動し、早く日本にもカラーテレビ放送が導入されないかワクワクした。
「ラジオ東京放送」が開局された。ラジオは、戦後の国が荒れて復興が大変な間も、情報収集が難しい時期も新しい情報を直ぐに受信する事が出来たので重宝された。",,,,,
,1951,,,,,,,,,サンフランシスコ平和条約　締結,アメリカのサンフランシスコで平和条約が締結された。もう日本で爆弾が落とされたりすることはないのだ。戦争が終わってよかったと思った。これからは戦争で人が死なずにすむ平和な世界になってほしい。,,,,,
,1951,,,,,,,,,紅白歌合戦　第一回,新年が明けた1月3日にラジオによる中継で放送された。60分という短い時間だったが、新年という特別な番組のように思っていた。,,,,,
,1951,,,,,,,,,平和条約,サンフランシスコ講和会議にて全52カ国の代表が参加して開催された。多くの国と日本国との平和条約（講和条約）締結した。,,,,,
,1950,,,,,,,,,映画の影響で赤い靴が流行る,イギリス映画の「赤い靴」の影響で赤い靴が流行る。当時の娯楽と言えば映画が人気で、このような映画から生まれるファッションのことを「シネモード」と言われるようになった。,,,,,
,1950,,,,,,,,,デイヴィッド・ホイーラーがEDSACを使って世界最初のCG「高原のダンサー」を製作した,"CGは現実を切り取った映像でなく新たにリアルな世界を作り出せる面白い技術だと感じた。
又、フォン・ノイマン達がENIACで「24時間の天気予報」を開始した。２４時間、1日中、この時間は雨が降りそうだと分かる事が、事前に把握でき、出先で突然雨に降られる様な事が減り、24時間の天気予報は大変役立った。
日本では「国産テープレコーダー」を発売した。音声の記録、再生が気軽に行なえる様になり外国の技術を取り入れ、より便利な生活が出来る様になった。
アメリカではジェット戦闘機が大西洋無着陸横断を果たし、感動した。",,,,,
,1950,,,,,,,,,朝鮮戦争、12年ぶりにサッカーW杯開催,,,,,,
,1949,,,,,,,,,湯川秀樹ノーベル賞,日本人として初めてノーベル賞を受賞した人物。中間子という粒子の存在を予言し、12年後に宇宙線観測によってその粒子の存在が確認された。敗戦し淀んだ空気をまとっていた私たちはそのこと知って喜びに満ち溢れた。ちなみ中間子は湯川が名付けたものである。,,,,,
,1949,,,,,,,,,多くのラジオメーカーが倒産,戦後の悪性インフレを抑えるためにとられた金融引き締めにより、多くのラジオメーカーが倒産した。しかし、ラジオを買う人にとっての障害はそれほど大きくはなかったので、家族とラジオを流しっぱなしで生活していた。,,,,,
,1949,,,,,,,,,三菱電機が「炊飯器」を発明した,"火起こしをしなくても、素早くご飯が炊ける便利さに感動した。
そして日本が軽自動車を発明した。小さくて小回りが利くし、歩いて目的地へ向かうよりも圧倒的に早く着く事が出来る時間を無駄にしない移動手段が増え嬉しかった。
アメリカにて「AP(合衆国連合通信社)」が成立し通信環境を整える技術が更に発展していく。アメリカ、ケープ・カナベラルに「ロケット実験基地」が設立された。これから遥か遠い宇宙へメディアが到達する可能性に期待した。メディアの発展に期待で心躍った。",,,,,
,1949,,,,,,,,,湯川秀樹ノーベル賞受賞,,,,,,
,1949,,,,,,,,,流行のロングスカートを買う,戦争をしている時はずっともんぺを着ないといけなかったから、おしゃれなスカートが履けて嬉しい。裾が長いので踏まないように気をつけようと思った。,,,,,
,1949,,,,,,,,,日本初ノーベル賞受賞,私はこれまでノーベル賞についてあまり理解をしていなかったが、日本人で初のノーベル賞を受賞した湯川秀樹さんが日本で注目されると改めて偉大なことなのだと実感した。,,,,,
,1948,,,,,,,,,セロテープ,ばんそうこう類や軟膏（なんこう）など医療品を販売していた日絆薬品工業が前年（昭和22年）9月に発売したのが、今もおなじみセロテープだ。,,,,,
,1948,,,,,,,,,「LPレコード」が生み出された,"直径30㎝のレコードで、長期間記録出来るのでクラッシック曲の収録や、アルバムとして活用された。クラッシックを流すといつもよりゆっくりとリラックスした時間を過ごす事が出来た。
アメリカの、テレビジョン放送の電波を受信し、映像と音声を視聴する為の受信機である「テレビ受像機」が、20万代から75万代へ増産された。テレビがどんどんと普及されていった事が分かる。テレビは気軽に新しい情報を手に入れられ、娯楽も楽しめる素晴らしいメディアだと感じる。",,,,,
,1947,,,,,,,,,「立春に卵が立つ」と話題になる,東京気象台でも実験に成功していたから、うちも試してみた。でも成功せず、ただ卵が割れてしまってお母さんに叱られた。去年出た最新カメラを買った友達から、白黒で卵の立った写真が後日送られてきて羨ましかった。,,,,,
,1947,,,,,,,,,ネズミ取り器,1947年にネズミ取り器が発売された。今では一家に一台持っている人は少ないと思う。私も実際どんな物か知らない。と考えると、昔は家でネズミが出てたんだと思った。ゴキブリでも出たら怖いのにネズミとなると想像ができない。,,,,,
,1947,,,,,,,,,エドウィン・ハーバード・ランドが「インスタントカメラ」を発明した,"インスタントカメラは、写真を撮るとすぐに現像されて出てくるカメラだった。どんな感じに撮れたのかすぐわかるので便利だった。
C・イェーガーは、ジェット機で初めて超音波速度に到達する事を果たした。そんな速い速度で移動できる機械が生み出されるなんて技術力の進化に感動した。",,,,,
,1947,,,,,,,,,100万円宝くじ発売,,,,,,
,1947,,,,,,,,,100万円宝くじ発売,"当たれば100万円がもらえるというくじが販売されたが即日売り切れた。
みんな戦後の自分たちの生活で手一杯で藁にも縋る思いだったからだろう。",,,,,
,1947,,,,,,,,,6・3・3制,教育基本法により、男女共学が始まった。そして、今までになかった教科『家庭』が創設された。今までになかったことで正直驚きを隠せないが、これから頑張って慣れていくしかないと思うので頑張ろうと思う。,,,,,
,1947,,,,,,,,,学校給食開始,捕食給食と呼ばれるもので主食の米飯については各自自宅から持ってくるものとなっていたが、トマトシチューなど美味しいものがたくさんあった。,,,,,
,1947,,,,,,,,,学校給食始まる,その日は初めてお弁当を持たずに学校へ行きました。みんながソワソワして、給食を待っていました。みんなで同じものを食べて、たくさんお喋りをしました。一番おいしかったのは、冷凍ミカンでした。,,,,,
,1946,,,,,,,,,ラジオの新番組,『のど自慢素人音楽会』やクイズ番組『話の泉』など、新しいラジオ番組が次々と始まった。『英語会話』のテーマソングや『尋ね人』など、リスナーの大きな関心を呼んだ。,,,,,
,1946,,,,,,,,,ピース(タバコ)発売,当時のタバコは10本で20～60銭に対し、ピースは10本で7円という高級たばこ。「ピース」という名の由来は戦後の混乱期、未来の平和を願って名付けられた。やはり高級なタバコのほうが「おいしい」と感じるのだろうか…。,,,,,
,1946,,,,,,,,,日本国憲法公布,1946年11月3日に公布され、翌年5月3日に施行された。「あたらしい憲法のはなし」として教科書に憲法の紹介がされ、社会に浸透することとなった。,,,,,
,1946,,,,,,,,,コンピューターの誕生,1946年、世界初のコンピューター「ENIAC」がアメリカで開発される。コンピューターと言っても現在のように卓上に乗るものではなく、部屋いて面を占めるほど大きなものだった。,,,,,
,1946,,,,,,,,,日本国憲法が公布される,11月3日に日本国憲法が公布された。戦争も終わり、日本国憲法が公布されたことにより、新しい日本が始まったと感じた。,,,,,
,1946,,,,,,,,,９歳で美空ひばりがデビュー,デビュー当時、天才少女歌手と話題になった。代表曲「川の流れのように」をはじめ、レコーディング曲数は1500曲もあった。間質性肺炎により52歳という若さでこの世を去った。,,,,,
,1946,,,,,,,,,日本で「オール・ウェーブ・ラジオ」が発売された,"ラジオで色々な情報や話題を取り入れていた。
又、アメリカのペンシルヴェニア大学でデジタル・コンピューターである「ENIAC」を開発した。1万8千本の真空菅を用いたもので、プログラムは配線によって行っていた。こんな複雑なプログラムを組み立て、そして成功させ発明できる研究者の方々を尊敬した。",,,,,
,1946,,,,,,,,,戦後初の総選挙、コンピュータの登場	,,,,,,
,1946,,,,,,,,,のど自慢誕生,NHKののど自慢がラジオ放送で始まる。戦争が終わってわずか５か月後。ダメもとで応募してみたがやはりダメだった。,,,,,
,1946,,,,,,,,,コンピューター登場,1946年、世界初の電子式コンピューター「ENIAC」が登場。計算手順を変更する場合は、本体の配線を手作業で設定し直していた。,,,,,
,1946,,,,,,,,,コンピュータ「ENIAC」の登場,世界初の電子式コンピュータ「ENIAC」が登場した。このときは、コンピュータとは無縁だったため、すごいものが出できたな、くらいに思っていた。難しい仕事をする偉い人が使うようなイメージだった。,,,,,
,1945,,,,,,,,,第1回宝くじ,戦後いち早く発売された。宝くじはよく親と買っていたが1等や2等など当たったためしがない。「漢字くじ」という偽物が出回るほどの人気だった。,,,,,
,1945,,,,,,,,,終戦,1945年８月15日正午、ラジオで玉音放送が行われた。天皇陛下の肉声で降伏が発表されることで、日本人全員が終戦を知った。,,,,,
,1945,,,,,,,,,戦争が終わる,苦しい生活からやっと終わると安堵した。とにかくこの環境から解放されることに対して、喜ぶ気持ちが強かった。戦争など二度と繰り返してはいけないと強く思った。,,,,,
,1945,,,,,,,,,玉音放送,8月15日、ラジオから「日本が無条件降伏した」と聞こえた。突然のことに驚き、信じられなかった。誰かが「天皇陛下のお声だ」と言った。ラジオでは顔が見えないため声の主は分からないが、天皇陛下の声ならば嘘ではない。日本は負けたらしい。,,,,,
,1945,,,,,,,,,電話加入数激減,戦争終結時のこのとしは、電話加入数が約半分まで激減した。戦災により都市部が焼け野原になったためだ。開戦当時までは、順調に加入数がのびていたため大きな影響を及ぼしたことがわかる。家がなくなってしまったり大変だ。,,,,,
,1945,,,,,,,,,第二次世界大戦終戦,「玉音放送」によって天皇陛下から終戦を告げられた。難解の漢語がつかわれていたため、詳しい内容はよくわからなかった。多くの人を犠牲にしたのに負けた悔しさと、やっと戦争が終わった解放感で自然と涙があふれた。,,,,,
,1945,,,,,,,,,終戦を知られる玉音放送,8月15日正午、家族や近所の人たちと一つの受信機を囲み、玉音放送により戦争終結を知った。辛く悲しい戦争が終わること、敗戦の宣言であることを告げられたこの日を忘れることはないだろう。,,,,,
,1945,,,,,,,,,東京大空襲が起こる,多大な資源の被害、町は火の海になり、多くの被害者が出た。広島、長崎に原爆が投下された。原爆は一瞬で人の命が呆気なく吹き飛ばす、大変恐ろしく悲惨なものだった。技術力の進化は大切なことだが使い道を間違うと狂気にもなり得るのだと恐ろしさを知った。戦いを終え、多くのものを失った。戦争が終結した事を私たち国民に知らせたのはラジオのメディアであった。いきなりラジオで負けた事を知らされた私達日本国民は唖然とした。それまでは劣勢である事は伝えられず、ずっと戦地へ向かわされていた。誤った情報で国民を操作するのは許される事でないと感じた。情報の真偽の大切さを痛感した。,,,,,
,1945,,,,,,,,,原子爆弾投下、無条件降伏、終戦,,,,,,
,1945,,,,,,,,,戦争の終わり,長かった戦争が終わった。日本は負けた。沖縄本土、広島、長崎、日本中の人が傷ついた。お国のためと命を散らせていった多くの人に恥じない生き方をしなくてはならない。,,,,,
,1945,,,,,,,,,神戸大空襲で町が壊滅,空襲警報のサイレンが鳴り、空から爆弾がいくつも降ってきた。見慣れた建物などが燃えて火の海になっていたが、逃げるのに必死で気にしている暇がなかった。,,,,,
,1945,,,,,,,,,玉音放送,8月15日正午に昭和天皇が国民に直接告げたラジオ放送である。初めて聞く昭和天皇の声に皆が静かに聞いていた。,,,,,
,1945,,,,,,,,,希望音楽会,戦後初の音楽番組である希望音楽会の放送が始まる。ここで初めて披露されたリンゴの唄は大ヒットした。私もラジオにかじりついて聴いていた。,,,,,
,1945,,,,,,,,,終戦の玉音放送	,お昼頃、お父さんとお母さんに呼ばれて居間に集まりました。ラジオの前で正座をして座らされ、よくわからない男の人の声を聴かされました。家にラジオがない人が、私の家にたくさん集まりました。その中には泣いている人もいました。,,,,,
,1945,,,,,,,,,広島、長崎に原子爆弾投下,小学生の頃、広島の原爆ドームへ行ったことがあるが、あまりにも残酷で、日本で起こった事実として受け止めたくなかったことをよく覚えている。この原爆投下後、日本が無条件降伏という形で終戦した。,,,,,
,1944,,,,,,,,,「電子レンジ」が生み出された,"暫く置いていて覚めてしまったご飯を、また温かく美味しい状態に戻せる優れものだ。そんな温かく人の為になるメディアと対極的に、核兵器が生み出された。兵器作り備えることは、戦争のきっかけになり得てあまり良い事と考えられるか難しいが、いきなり攻撃される等もしもの時の対処初段は必要だ。だが、核兵器を使わない世の中になって欲しい。
又、バネ状の玩具「スリンキー」が発明された。階段の上など高い所から徐々に落とすと、歩くような動きで、跳ねる。単純ながら面白いおもちゃで、何度も階段から落として遊んで楽しめた。",,,,,
,1944,,,,,,,,,コンピュータの登場,コンピュータというものが登場したらしい。まだ詳しくは分からないが、いつの日かコンパクト化されて私たちの手に渡る日がやってくるのかもしれないと考えただけでわくわくが止まらない。,,,,,
