Group,Year,Month,Day,Time,End Year,End Month,End Day,End Time,Display Date,Title,Detail,URL,Image URL,Image Credit,Type,Color
,2020,,,,,,,,,新型コロナウイルスで様々な場所で影響,大学の課題に取り組んだり、高校生の時からの友達とLINEでお話したり、グループ電話をした。離れていても、課題を提出したり、誰かと話したりすることができるから、改めてインターネットやSNSってすごいなと思った。,,,,,
,2020,,,,,,,,,新型コロナウイルスが世界で大流行,大学での授業がオンライン授業になり、大量の課題に追われることに。だが、オンライン授業にもいろいろな受け方があってそれなりに楽しい。,,,,,
,2020,,,,,,,,,新型コロナウィルス感染拡大のため緊急事態宣言が行われた,この期間は外出を控え、人に直接会うことが少なくなった。この外出自粛期間中は、ZoomやSlackで授業を受け、Nintendo Switch用ゲームソフト『あつまれどうぶつの森』で友達と通信して遊んだり、オンラインで人との繋がりを保つことができた。,,,,,
,2020,,,,,,,,,新型コロナウイルスの流行,コロナウイルスの流行の影響で「3密」が避けられたため、zoomやskypeを利用した在宅業務や授業が行われる。「ステイホーム」と言われた家での時間が増えると同時にインターネットの需要が高まる時期となった。,,,,,
,2020,,,,,,,,,新型コロナウイルスが大流行する,授業が全部オンラインになる。自分の携帯にたくさんの課題が送られてきて、いつも遊んでる時間がなぜかそわそわして焦ってしまう。初めて顔を合わせる同級生と画面越しに一緒に授業を受けてるのが不思議。,,,,,
,2020,,,,,,,,,新型コロナウイルスが世界的に大流行,コロナウイルスの影響で外出自粛が続き、授業もオンラインで受けるという以前まで考えもしない事態に陥った。zoomなどを利用し、友人たちとオンラインでDVD観賞会を行った。外出せずとも楽しめる方法を発見できた。,,,,,
,2020,,,,,,,,,新型コロナウイルスが流行する,大学の前期の授業が全てオンライン授業になった。ZoomやSlackなどのアプリを使ったやり取りや、ウェブ上で行われる授業配信など全てが初めてのことばかりで不安が膨らむ。しかし、自宅でも授業に参加出来ることから便利な世の中になったことを実感した。,,,,,
,2020,,,,,,,,,新型コロナウイルスが流行る,新型コロナウイルスが世界中で流行る。そのため、大学を中心に高校や中学校でも自宅で学習できるようにオンライン授業を開始する。国としてもオンライン授業に必要なＷｉ－Ｆｉを無料で提供するサービスを行ったり、補助金をだした。,,,,,
,2020,,,,,,,,,switch lightを手に入れる,ゲームに全く興味がなかった私が、ついにswitchを買ってしまう。「あつまれどうぶつの森」というソフトが大流行し、コロナウイルスで外に出られないときに、のびのび暮らすことが出来るゲームに夢中になり楽しかった。ほしいどうぶつを手にれるために、高額でそのどうぶつが手に入れることが出来るカードが転売され「人身売買」だと話題になった。,,,,,
,2020,,,,,,,,,新型コロナウイルスが流行する,大学の授業がオンラインだったり、課題提出のみになったり、黒板やではなくパソコンに向かう日々になった。毎日が夏休みの最終日のようで慌ただしい。,,,,,
,2020,,,,,,,,,コロナウイルスが蔓延して大学の前期の授業がオンラインになった,今までにない新しい授業形態で新感覚だった。色々なデジタルの授業体制があって色々な経験が出来た。家の中で授業が出来る程のメディアの進化にも驚いた。自粛を機に色々な有名人がYouTuberデビューをしていた。,,,,,
,2020,,,,,,,,,新型コロナウィルスが世界中に広がった,大学の授業がオンラインになった。Zoomなどのアプリで全く知らない人と画面越しに会話するのが苦痛だ。私は大学で部活動に入っているが、zoomを繋ぎみんなで筋トレをすることになるとは思っていなかった。月水金土は毎朝１０時からなので起きるのがしんどい。他にも週一でダンスを撮りコーチに送ってアドバイスをもらっているのが新鮮だ。,,,,,
,2020,,,,,,,,,新型コロナウイルス蔓延,感染対策として、世界的にオンラインでの授業や業務が主流となる。これを機に、新しい学び方や働き方を見出す企業、学校も多い。しかし突然の変更を余儀なくされ、私を含め、順応することに時間がかかる人も少なくはないようだ。,,,,,
,2020,,,,,,,,,念願のNintendo Switchゲット,新型コロナウイルスの影響で自宅での自粛生活を余儀なくされた。これを機に、以前から欲しかったNintendo Switchを買おうと決めた。親戚中の力を借りて片っ端から抽選に応募しまくった。結果無事にゲットできたのを今でも鮮明に覚えている。,,,,,
,2020,,,,,,,,,新型コロナウイルスが流行,感染防止のため学校にも行けなくなり、外出する機会がほとんどなくなった。友達と会って話したりするのが難しいので、早く収束してほしい。,,,,,
,2020,,,,,,,,,外出自粛の生活,新型コロナウイルスの影響で外出自粛となり、「あつまれどうぶつの森」が世界中で話題となった。ソーシャルディスタンスのなか「あつ森」を通して結婚式や誕生日会などを開催する人々が現れた。,,,,,
,2020,,,,,,,,,迷惑メールに悩まされる,携帯を持ちはじめてから随分経つが、最近突然迷惑メールが送られてくるようになる。おそらく同じところから謎の情緒不安定なメールがきっかり１時間に一回届く。アドレスを変更するか迷う。,,,,,
,2020,,,,,,,,,コロナウイルス蔓延でオリンピック中止,中国で発症した新型コロナウイルスが世界各国に広まり世界中が混乱に陥った。そのため、日本では開催予定だったオリンピックが中止と断念された。4年後に開催されるかはまだ不明である。鬼滅の刃連載終了。,,,,,
,2020,,,,,,,,,新型コロナウイルスが世間に混乱をもたらす,大学の授業はオンラインになった。今の時代だからこそこの授業法でも成り立っているのだと思う。生きている中で最も楽しみにしているライブイベントがすべて中止になった。とても悲しくてやるせないが、YouTubeなどで歌をアップしたり活動をして下さるので、ネットが普及していて良かった。,,,,,
,2019,,,,,,,,,Instagramのアカウントを作成,Instagramに載せるような映える写真を普段撮影しないし、あえて流行に逆らってアカウントを作っていなかった。しかし、好きなアーテストが日本初個展の会場で初のインスタライブをするということで、視聴するためにアカウントを作成した。,,,,,
,2019,,,,,,,,,ストレスはまだフリーにならないワイヤレスイヤホン,通学用にと買ってもらったワイヤレスイヤホン。線がないためストレスがなくなったと思いきや突然片耳から音が消えたり、音ゲーをしようにも音がワンテンポずれてしまう。これから発売される未来のイヤホンに期待しよう。,,,,,
,2019,,,,,,,,,Nintendo Switch用ゲームソフト『ポケットモンスター ソード・シールド』が発売,私はこの時をずっと待っていた。友達とはもちろん、オンライン上で知らない人とも交換やバトル、新要素の「マックスレイドバトル」などで一緒に遊ぶことができた。Switchになってグラフィックや音楽が非常に奇麗になり、技術の進歩が感じられた。,,,,,
,2019,,,,,,,,,Nintendo switch lite　発売,既存のNintendo　switch　の携帯型の発売。これにより持ち運びがしやすくなった。また同年発売された「ポケットモンスター　剣/盾」が大ヒットする。,,,,,
,2019,,,,,,,,,コード決済増える,ＰａｙＰａｙなど現金ではなくコード決済が若者だけではなく、幅広い世代に受け入れられ、スマホで支払う人が増えた。,,,,,
,2019,,,,,,,,,大学に入った,WordやExcel、PowerPointの使い方を詳しく勉強出来た。表現の仕方が広がった。Instagramでお洒落な写真を載せる人が多い印象を持った。「インスタ映え」の為に見栄えの良いスイーツを食べたり映えるスポットに行ったりお洒落していて凄いと感じた。,,,,,
,2019,,,,,,,,,星野源のライブに行った,ライブで星野源が「アイデア」という曲をどういう気持ちや思いを込めて作ったのかを話していた。ライブに行かなかったら知らなかった情報だったので得した気分になった。次のライブも行きたい。,,,,,
,2019,,,,,,,,,タピオカ襲来,同時にタピオカジュースが世界規模で流行しました。若い世代のタピオカブームが続き、日本国内にタピオカを取り扱う店舗が急増し、人気店には行列ができた。,,,,,
,2018,,,,,,,,,「おっさんずらぶ」が新語・流行語大賞に選ばれる,めちゃくちゃ面白い。女子大でよく性について学ぶけど、これで同性愛についての偏見が減るといいなあと思った。久しぶりに、映画も見たいと思えた作品だった。私も恋愛したいなあ、いいなあ…,,,,,
,2018,,,,,,,,,Tiktokが登場,今、小学生もスマホを持つこ世代、和達たちの周りにはtiktokと言う新たなアプリが誕生した。Tiktokは誰でも動画を投稿でき、そして、誰でも動画にコメントを書くことが出来る。したがって、まだ、言葉に重みがあることをわかっていない小学生などの誹謗中傷なコメントも見られる。私が小学生の頃、スマホを持っている者も少なかったし、SNSで知らない人と絡むこともなかった。,,,,,
,2018,,,,,,,,,インスタグラムで投稿する人増える,インスタグラムを見るだけではなく、初めて投稿した。この頃にはインスタ映えを狙って写真を投稿したり、インスタ映え巡りといってカフェに行ったりした。,,,,,
,2018,,,,,,,,,ニコニコ生放送で中継される,部活の個人大会の決勝で、メインで中継されるはずだった試合が直ぐに終わってしまい、私の試合が中継された。結果は僅差で負けてしまった。タイムシフトを見ていると｢😊たんかわいそう｣というコメントがあり、複雑な気持ちになった。,,,,,
,2018,,,,,,,,,高校を卒業した,高校卒業の日は放課後に携帯を使う事が許可されていたので、友達と集まって写真やムービーを取った。中学の時は携帯が無く家族にカメラを持って来てもらうか持参する等、手間が掛かってしまったが、携帯が広まり便利になったと感じる。家に帰ってからまた同じクラスの友達とお出かけして記念にプリクラを撮った。携帯で、プリクラのある機種の会員登録していた友達が画像データを、LINEを介して送ってくれて有難かった。,,,,,
,2018,,,,,,,,,本格的にYouTuberにハマった,前からYouTubeは見ていたが「水溜りボンド」にどハマりした。よく考えてみれば芸能人でもない人に物凄いファンがいるのが不思議になった。自分で企画し撮影し発信する。これをやろうと思うのがすごいと思う。,,,,,
,2018,,,,,,,,,自分のパソコンを持つ,修理から帰って来た古いパソコンが私の物になった。これからはYouTube見放題である。しかしたまに調子が悪くなるので頑張ってほしい。,,,,,
,2018,,,,,,,,,大阪北部地震が起こる,震源地近くに住んでいたため、かなり揺れが激しかった。余震に怯えながら、突如日常を奪われた不安とストレスの中でもスマホを握りしめ暇さえあれば安心したくてTwitterを見ていた。,,,,,
,2018,,,,,,,,,Virtual YouTuber(Vtuber)がヒットする,ネットでゲームや歌、雑談を配信する人はそれまでにも多くいましたが、Live2Dを利用し、動いている姿を見せる新しい配信スタイルのYouTuberがにじさんじやホロライブから続々と発表される。３Dではなく２Dなのでモデリングが早く、コストも抑えられるため画期的なブームだと思う。,,,,,
,2018,,,,,,,,,Tiktokが登場,今、小学生もスマホを持つこ世代、和達たちの周りにはtiktokと言う新たなアプリが誕生した。Tiktokは誰でも動画を投稿でき、そして、誰でも動画にコメントを書くことが出来る。したがって、まだ、言葉に重みがあることをわかっていない小学生などの誹謗中傷なコメントも見られる。私が小学生の頃、スマホを持っている者も少なかったし、SNSで知らない人と絡むこともなかった。,,,,,
,2017,,,,,,,,,ガラケーからスマートフォンになる,約4年間使っていたガラケーからスマートフォンデビュー。ガラケーと比べて画面が大きくて画質がキレイ。LINEが主流になり始めていたのに、まだメールでやり取りしていたので、LINEで連絡を取れるようになって嬉しかった。,,,,,
,2017,,,,,,,,,Nintendo Switch発売,家でも使え、外出しても携帯して使える素晴らしいゲーム機。今現在（2020）では「あつまれ どうぶつの森」が大変人気でNintendo Switch自体が品切れとなるほど。今思えば、発売されたときに買っておけばよかったとずっと後悔している（まだ手元にない勢）。,,,,,
,2017,,,,,,,,,任天堂の家庭用ゲーム機「Nintendo Switch」が発売,発売当初から人気で近くのお店では品切ればかりだった。しかし、ふと寄ってみたお店に1つだけ置いてあるのを見つけ、即購入した。最初に遊んだゲームは「スプラトゥーン」で、毎日何時間も遊ぶくらいはまっていた。,,,,,
,2017,,,,,,,,,「インスタ映え」が流行語大賞に,インスタグラムに創意工夫がされた写真を投稿することで「インスタ映え」を目的とする投稿が増えた。そのため「インスタ映えスポット」を訪れる人も増え、集客方法に新たな一手が増えたのではないだろうか。,,,,,
,2017,,,,,,,,,Nintendo Switchが発売される,突然両親が購入してきた。とりあえず「スプラトゥーン２」をプレイ。途中からオンラインでのプレイが有料になったため、ほとんどプレイしなくなった。,,,,,
,2017,,,,,,,,,インスタグラムを始める,インスタを始めた。まだ投稿もせずただ芸能人や友達の投稿を楽しんだ。ツイッターを今まではしていたが、それとは違って長文が一回で書けるし、写真をメインにしているアプリだったので気軽に楽しめた。,,,,,
,2017,,,,,,,,,修学旅行があった,旅行先の写真を携帯のカメラで撮る事が出来て、思い出を残せてメディアの良さを感じた。空港から帰る際も携帯で気軽に家族に電話で連絡を取れるのが良かった。行事で写真を残せる点等色々と便利だと感じる。,,,,,
,2017,,,,,,,,,スマホを買ってもらう,初めてのスマホを買ってもらった。周りの友達がみんなスマホをもっていたのでやっと買ってもらったという感じだった。LINEスタンプを送りあうのが楽しかった。,,,,,
,2017,,,,,,,,,ついにInstagramを始める,Twitterで長らく生きてきたため、オシャレ投稿も出来ないのにInstagramを始めた。今では撮影した花をポストするだけのアカウントになっている。,,,,,
,2017,,,,,,,,,トランプ大統領就任,将棋の藤井聡太四段が29連勝し、アメリカではオバマ大統領の引退後新しい大統領はドナルド・トランプ氏に決定した。上野動物園ではパンダの赤ちゃん香香が誕生した。,,,,,
,2016,,,,,,,,,Twitterを始める,携帯ショップでもらったタブレットで、興味があったTwitterのアカウントを作成。しかし様々な機能があり分からないことが多くて、友達にいろいろ聞いていた。,,,,,
,2016,,,,,,,,,スマホでかわいく盛れちゃうSNOW,なんとスマホで自分たちをかわいく盛れてしまう無料アプリ「SNOW」が登場。たくさん種類があり、かわいいものから面白いものまであるので楽しくて飽きない。どこでもいつでも取れるため便利だ。,,,,,
,2016,,,,,,,,,ポケモンGOの配信がスタートする,配信開始日の夜外出すると、スマホを手に多くの人が歩き回っていた。友人たちが「こっちにあのポケモンおったで！」とはしゃぐ様子を見て、本当にこの世界にポケモンがいるような会話にわくわくしたが、全員画面に吸い込まれるようにプレイしており、少し不気味だった。あの時必死にポケモントレーナーをしていた友人は現在、無人島でどうぶつたちと優雅に暮らしている。,,,,,
,2016,,,,,,,,,Skypeで友人と通話を楽しむ,LINEで通話すると何故か友人の回線落ちがひどいので、Skypeで通話を始めるようになった。Skypeの方が音質も良く、他のアプリを開いても途切れることが少なかったため、利用しやすかった。ただ頻繁に勝手にログアウトしてしまう現象が続き、アカウントをいくつも作ることになった。,,,,,
,2016,,,,,,,,,ツイッターを始める,ツイッターを始めた。これは、思ったことを気軽につぶやけるので、たくさんの人とお話したり、面白い話が回ってきて楽しかった。だが一方でなりすましが現れたり、誹謗中傷をする人がいて問題になっていた。,,,,,
,2016,,,,,,,,,Twitterを始める,高校入学直前に同じ高校の人と繋がりを持とうと買ってもらったばかりのiPhone 6sを慣れない手つきで操作した。DMで個人的に連絡を取り、これから友人になるのだと入学式をより楽しみなものにしようと不安を減らそうとしていたことが懐かしい。,,,,,
,2016,,,,,,,,,携帯のアプリLINE等でチャットや電話なども気軽に出来る様になりコミュニケーションをすぐに取れる事に感動した,ソーシャルゲーム等アプリも多彩に揃っていてとても便利だと感じた。色々なゲームにハマったし、新しいゲームを友達に勧められて始める等し、色々なアプリを試した。電卓や歩数計の機能もついていて生活する上でも便利になっていった。,,,,,
,2016,,,,,,,,,ガラケーを乗り越えスマホへ,周りがスマホを持っているのに自分は持てないことが悔しかった。スマホと手に入れた瞬間いろんなアプリやゲームを入れまくった。お父さんがしていたので、ずっとパズドラをしていたのを覚えている。お父さんがポケモンゴーにハマり、夜中に山まで歩いていのししに遭遇して、お母さんに怒られていた。,,,,,
,2016,,,,,,,,,華のJK爆誕,待ちに待った高校生にやっとなれた。県外からの進学になるため、友達が一人もいない状況だった。それを回避するためにTwitterで事前に同じクラスになる子と繋がっておいた。JKスタートは完璧だ。SNSってすご！！,,,,,
,2016,,,,,,,,,北朝鮮ミサイル発射,北朝鮮がミサイル発射や核実験で世間を騒がせていた。日本ではスキーツアーバスが転落し、15人が死亡するという悲惨な事件が起こっていた。熊本では震度七の地震が発生した。,,,,,
,2016,,,,,,,,,ペンタブレットを使って絵を描くようになる,それまでは３DSで描いていた。デジタルイラストはもう10年以上前から普及していたが、長い目で見ると歴史は浅く、最近のソフトや性能の進化は著しい。,,,,,
,2016,,,,,,,,,ストーリー機能,インスタグラムにはストーリーという機能がある。ストーリーは24時間で消えてしまう投稿だ。今、私達の周りでは写真の投稿よりもストーリーの投稿をしている人の方が多い。このストーリーはメリットもあるがデメリットもある。今私達はメリットよりもデメリットの方がある気がする。,,,,,
,2015,,,,,,,,,Apple　Watchの発売,"腕時計型の端末の発売により社会は大きく驚いた。
時計としての役割だけでなく、健康管理などの様々な機能も搭載されていた。",,,,,
,2015,,,,,,,,,「爆買い」が新語・流行語大賞に選ばれる,都会の電気屋さんで、びっくりするぐらいの電子レンジなどを抱える中国人を見た。日本製のものってそんなに質がいいのだろうか。日本人として誇らしく思える。でも転売はよくない！,,,,,
,2015,,,,,,,,,スマホをもつ,スマホをもった。今までは実際に会って話すか母のスマホでやり取りするか、自宅の固定電話で話していたので、いつでもどこでも友達とやり取りが出来て暇つぶしにもなった。スマホでゲームをするほうではなかったが、中にはゲームに夢中で勉学が疎かになる人がいた。,,,,,
,2015,,,,,,,,,Line社の「Line MUSIC」や、Apple社の「Apple Music」等音楽配信定額サービスが本格的になっていって音楽を気軽に聞けるようになっていった,中学を卒業した。まだ携帯を持っていなかったので、カメラを持って行って友達と記念写真を撮った。部活の後輩の子が色紙でメッセージを寄せ書きしてくれていてとても嬉しい気持ちになった。手書きのメディアは気持ちがより伝わってきて、インターネットとはまた違う、特有の暖かさが伝わる所が魅力的だと感じる。よく遊んでいた友達は皆バラバラの高校に進学する事になったが、高校に上がる直前に携帯を買って貰えて友達とLINEグループを作りその後も繋がりを持てた。,,,,,
,2015,,,,,,,,,受験生にも関わらず、Twitterを始める,共通の趣味を持つ人と交流、絵をアップすることに夢中になった。私の受験失敗の原因はこれにもあると考えている。しかし、Twitterで絵を描き始めたことをきっかけに、やりたいことが見つかったといっても過言ではない。反省はしているが、後悔はしていない。,,,,,
,2015,,,,,,,,,初めてのラジオ機器,中学のラジオを作る授業で、初めてラジオに触れた。今まで聞く機会もあまりなく、聞くとしてもスマートフォン等で聞けたので、周波数を合わせるということを知らず、聞く方法がよく分からなかったことを覚えている。,,,,,
,2014,,,,,,,,,ワコム「Bamboo　Comic」ペンタブレット購入,イラスト投稿サイト「イラログ」にペンタブレットを使って描いたイラストを投稿し始める。小説を投稿するよりもイラストを投稿する頻度の方が多くなる。文章ではなく絵を使って自分の思いを表現することが楽しくなる。,,,,,
,2014,,,,,,,,,WiiＵ購入,2012年に発売されたWiiＵを2年遅れて購入した。なぜこのタイミングなのかというと、大乱闘スマッシュブラザーズ for WiiＵが発売されたからだ。ゲームキューブの時代から大乱闘スマッシュブラザーズシリーズを追いかけていたため、それはなんとしてでも、と兄弟でお金を出し合い購入した。なお使用するコントローラは今でもゲームキューブのコントローラである。,,,,,
,2014,,,,,,,,,携帯等無いのでネットワークを見るには、家では家族のパソコン、友達の家に遊びに行った際に一緒にパソコンを見たり、３DSを持って行って一緒に遊んだりした,友達が３DSの「うごくメモ帳」のアプリでアニメーションを描いてくれたりして遊ぶのが楽しかった。,,,,,
