Group,Year,Month,Day,Time,End Year,End Month,End Day,End Time,Display Date,Title,Detail,URL,Image URL,Image Credit,Type,Color
カール・フィリップ・エマヌエル・バッハ,1714,,,,1788,,,,,,,,,,,
ヨハン・ゲオルク・レオポルト・モーツァルト,1719,,,,1787,,,,,,,,,,,
フランツ・ヨーゼフ・ハイドン,1732,,,,1809,,,,,,,,,,,
フランソワ＝ジョセフ・ゴセック,1734,,,,1829,,,,,,,,,,,
ウィリアム・ダンカム,1737,,,,1818,,,,,,,,,,,
ヤン・クシュチテル・ヴァニュハル,1739,,,,1813,,,,,,,,,,,
クリスティアン・ゴットロープ・ネーフェ,1748,,,,1798,,,,,,,,,,,
ドメニコ・チマローザ,1749,,,,1801,,,,,,,,,,,
ダニエル・ゴットロープ・テュルク,1750,,,,1813,,,,,,,,,,,
ムツィオ・クレメンティ,1752,,,,1832,,,,,,,,,,,
ヴォルフガング・アマデウス・モーツァルト,1756,,,,1791,,,,,,,,,,,
イグナツ・ヨーゼフ・プライエル,1757,,,,1831,,,,,,,,,,,
ヤン・ラディスラフ・ドゥシーク,1760,,,,1812,,,,,,,,,,,
ルートヴィヒ・ヴァン・ベートーヴェン,1770,,,,1827,,,,,,,,,,,
ヨーゼフ・ヨハン・バプティスト・ヴェルフル,1773,,,,1812,,,,,,,,,,,
ヨハン・ネポムク・フンメル,1778,,,,1837,,,,,,,,,,,
トビアス・ハスリンガー,1787,,,,1842,,,,,,,,,,,
